"doc_id","AB","TI","DE","PY","DI"
"MASEDA A, 2025, TECHNOL FORECAST SOC CHANGE","Are entrepreneurially oriented family firms likely to embrace digital transformation? This study explores this compelling question, addressing the connection between entrepreneurial orientation (EO) dimensions and digital transformation (DT) in family-owned small and medium–sized enterprises (SMEs) while considering the moderating influence of leadership structure and generational involvement. Drawing upon upper echelon and socioemotional theories, we present findings from an analysis of 191 Spanish family SMEs. Our research indicates that while innovativeness and risk-taking positively influence DT, proactiveness does not have a significant effect on it. Interestingly, the familial nature of the CEO emerges as a crucial factor, exerting a negative influence on the innovation-driven and risk-taking pathways to DT. Our research also reveals that CEO–chair duality appears to hinder the relationship between risk-taking and DT, whereas multigenerational top management team (TMT) involvement negatively affects the relationship between proactiveness and DT. The results underscore the complexity of leadership dynamics and generational factors in shaping the EO–DT relationship and the critical role of strategic TMT composition in fostering DT within family SMEs. © 2025","Unpacking the role of entrepreneurial orientation in the digital transformation of family SMEs: The importance of leadership structure and generational involvement","Digital transformation; Entrepreneurial orientation; Family SMEs; Generational involvement; Innovativeness; Leadership structure; Proactiveness; Risk-taking",2025,"10.1016/j.techfore.2025.124248"
"PETRŮ N, 2020, E M EKON MANAGE","This article addresses Marketing 4.0 as an exceptionally dynamic field for company competitiveness that is evolving rapidly. The main goal of this article is to evaluate and compare the overall level of use of modern marketing tools in practice by family and non-family businesses, and subsequently to measure the dependence between the extent of Marketing 4.0 activities and number of employees, volume of sales, field of business, and year the company was established. Primary and secondary data was analyzed using basic and advanced statistical methodologies, including the testing of six hypotheses. The study showed that for both family and non-family businesses there has not been any significant increase in overall marketing vitality in the years studied. Indeed, the long-term focus of companies on values provided to customers and relationships with customers was confirmed. The results further showed that from the perspective of marketing vitality, one of the currently more significant weaknesses of smaller companies in particular of both family and non-family types is a missing or insufficient strategy for realization of marketing activities. This study confirms the dependence of the level of overall marketing vitality on sales volume and company size by number of employees, but on the other hand no dependence was proven between marketing vitality on field of business or year company established. This study evaluates the liminality and states that family businesses above all others address what is for them the more important strategic question, namely that of succession. The study is unique in that it compares the results of three studies carried out between 2016 and 2019. The context of this study is framed by an appeal to eliminate barriers to change and rapid response by companies to the needs, requirements, and expectations of customers operating in the online world. © 2020, Technical University of Liberec. All rights reserved.","Marketing tools in the era of digitization and their use in practice by family and other businesses","Digitization; Family business; Marketing 4.0; Marketing vitality; Non-family business; Trend tools",2020,"10.15240/tul/001/2020-1-014"
"WIĘCEK-JANKA E, 2025, MANAG PROD ENG REVIEW","The study investigates the integration of Industry 4.0 concepts within Polish family manufacturing enterprises, focusing on the evolving competencies required of Engineer 4.0 and Manager 4.0. Utilizing a survey of 178 family businesses, the research explores correlations between organizational characteristics—such as size, ownership, and technological sophistication—and perceptions of Industry 4.0 competencies. Statistical analyses reveal significant relationships between these characteristics and the evaluation of strategic management, interdisciplinary collaboration, and technical skills. Despite the transformative potential of Industry 4.0 technologies, implementation challenges persist, highlighting the need for tailored competency models to bridge these gaps. The findings offer valuable insights into aligning managerial and engineering expertise with the dynamic demands of modern manufacturing environments. © 2025 The Author(s).","Engineer 4.0 and Manager 4.0 Competencies in Polish Family Manufacturing Enterprises","engineer 4.0; family businesses; family firms; Industry 4.0; manager 4.0",2025,"10.24425/mper.2025.153935"
"COLAPINTO C, 2026, BUS ETHICS ENVIRON RESPONSIB","This paper explores the twin transition in family businesses, examining the parallel development of digital technologies and sustainable business practices, both of which are part of the current European agenda for a more sustainable future. While not widely recognised for their investments in disruptive innovation and digitalisation, family businesses (FBs) are more inclined to perform incremental changes, often driven by a longstanding commitment to sustainability and collaboration with internal and external stakeholders. This contrast makes them an ideal subject for a more in-depth exploration of these transformative trends. The aim of this study is to adopt a broader perspective in twin-transition analysis, incorporating social and economic performance alongside environmental sustainability in relation to digital transformation. Therefore, we establish a connection between the triple-bottom-line (TBL) approach and digital innovation in the unique reality of FBs. Our research approach is based on interviews conducted across multiple studies that explore FB dynamics and digitalisation in different industries and countries, supplemented by insights from secondary data. We analyse data through a directed qualitative content analysis. By adopting a broader perspective on sustainability—shifting from an exclusive focus on the environmental dimension to a TBL approach—our findings position FBs as key players in the twin transition, excelling at both addressing sustainability challenges and fostering digital innovation. These companies should prioritise aligning their strategies with equitable, viable and bearable principles in line with the TBL approach by fostering socio-emotional wealth, engaging younger generations in digital innovation and implementing work–life balance initiatives that enhance employee satisfaction and sustainability. Most of these strategies can also be replicated by non-family businesses, establishing FBs as exemplary leaders in the twin-transition journey. © 2025 John Wiley & Sons Ltd.","Introducing Twin Transitions in Family Businesses: A Triple-Bottom-Line Perspective","digitalisation; family businesses; innovation; intergenerational dynamics; triple bottom line; twin transition; work–life balance",2026,"10.1111/beer.12786"
"NIKOLAKIS W, 2022, BUS STRATEGY ENVIRON","Evidence shows that positive family dynamics can motivate environmental and social strategies (ESS) in family firms. Using a stated choice method, we examine how family conflict, trust and socioemotional wealth (SEW) influence ESS choices and interact with other trade-offs among family firms in two distinct cultural contexts: Chile and India. In Chile, we found that where there was more conflict, there were less ESS choices selected. However, in Chile, higher trust produced less relational conflict and more ESS preferences, suggesting supportive norms and group cohesion in these firms. Chilean respondents selected ESS choices more generally, which may be influenced by cultural dimensions that support sustainability, like uncertainty avoidance, indulgence and collectivism. Formal written sustainability visions in family firms created positive environmental norms in both countries and in Chile led to higher ESS preferences. Indian respondents with higher SEW were more likely to adopt ESS choices. Younger family firms in both countries were more likely to adopt ESS, suggesting generational dynamics and selectivity theory may be at play. Creating safeguards for maintaining positive emotional dynamics and tools for creating formal sustainability visions are important steps for enabling ESS among family firms. © 2022 ERP Environment and John Wiley & Sons Ltd.","What motivates environmental and social sustainability in family firms? A cross-cultural survey","choice method; culture; environmental sustainability; family dynamics; family firms; social sustainability; socioemotional wealth (SEW); sustainable development",2022,"10.1002/bse.3025"
"APPLETON S, 2025, SMALL BUS ECON","Digital transformation introduces a new set of parameters for firm innovation. Existing literature has found that family firms vary on their willingness to innovate. However, explanations of the factors that lead to a family firm’s (un)willingness to act remain scarce. Even more scarce are studies exploring the family firm’s (un)willingness in the digital transformation. The digital transformation is a promising environmental stimulus to unpack family firm (un)willingness due to its disruptive nature. This research uses a comparative multiple case study of 14 manufacturing family firms. The novel findings identify a variety of dispositions that can be divided into willingness-enabling and willingness-suppressing. Willingness affects how family firms potentially (do not) take advantage of the opportunities provided by the digital transformation. The contributions are twofold. First, the importance of considering the heterogeneity of family firms’ willingness toward digital transformation is highlighted. Second, by identifying the role of dispositions and related mechanisms we unpack the heterogeneity of the willingness. In sum, we provide a much-needed explanation of family firms in the digital transformation. © The Author(s) 2025.","Unpacking willingness in family firms facing the digital transformation","Digitalization; Family firms; Industry 4.0; Innovation; Willingness",2025,"10.1007/s11187-025-01057-8"
"WANG X, 2023, J COMPET","In the current big data era, digital technologies play a vital role for firms to improve their business and economic growth. Considering the firm type and the firm size, this study explores how digital technologies impact their performance in the financial and employment perspectives. The performance variables are presented at the capital, profit, debt-paying, and development levels from Total Economy Database TM and the Amadeus database for European companies from 2008 and 2019, in a panel data analysis. In this study, the sample only consists of good companies that generate profit. The results demonstrate that digital technologies positively affect shareholders' funds to a greater degree for non-family firms and non-SMEs. They make a positively larger impact on the return on capital employed by non-family and non- SMEs. Digital technologies would increase the solvency ratio for firms, except for SMEs. Finally, they make a positively larger impact on the operating revenue for firms that are nonfamily and non-SMEs, while the opposite is true for family firms and SMEs. Scientific research on digital technologies has significant managerial importance and competitiveness connecting family firms and SMEs. The research makes contributions for the relevant literature on digital technologies and offers four perspectives affecting performances. The findings benefit scholars, managers, and policymakers of family firms and SMEs. © 2023 The Author(s).","The role of digital technologies in firms' performance: A panel data study on family firms and SMEs","Digital technologies; employment; family firms; financial performance; SMEs",2023,"10.7441/joc.2023.02.08"
"CHAUDHURI R, 2023, J FAM BUS MANAG","Purpose: This study assesses the capability of artificial intelligence integrated customer relationship management (AI-CRM) technology for sustaining family businesses in times of crisis, such as the COVID-19 pandemic. The study also investigates the moderating role of strategic intent in sustaining family businesses in times of crisis. Design/methodology/approach: The authors used dynamic capability view theory and related literature on family business and technology adoption to develop a conceptual model. This model has been validated using the structural equation modeling technique considering 332 usable responses from people of India involved in family businesses and technology adoption. The study also uses multigroup analysis to examine the moderating role of strategic intent. Findings: The study finds that adoption of AI-CRM technology significantly and positively impacts dynamic capabilities of the family businesses, such as sensing, seizing and transforming capabilities, which in turn positively and significantly influences their sustainability during crises. The study also highlights the significant moderating impact of strategic intent for sustaining family business firms in uncertain times. Practical implications: This study has highlighted the importance for family businesses to adopt AI-CRM technology and its influence on their dynamic capabilities. The study also provides important inputs to the management of family businesses regarding adoption of new technologies and their significance during crises. The study also documents that strategic intent could help family businesses to survive during such times. The study is conducted in India and thus cannot be generalized. Originality/value: This study table is unique in that it investigates the influence of AI-CRM technology and the moderating role of strategic intent on family business sustainability in times of crisis. Moreover, the proposed theoretical model is a unique model with explanative power of 71%. © 2022, Ranjan Chaudhuri, Sheshadri Chatterjee, Sascha Kraus and Demetris Vrontis.","Assessing the AI-CRM technology capability for sustaining family businesses in times of crisis: the moderating role of strategic intent","AI-CRM; COVID-19; Family business; Seizing; Sensing; Strategic intent; Sustainability; Transformation",2023,"10.1108/JFBM-12-2021-0153"
"SHRIYA K, 2026, QUBAHAN ACAD J","This study examines the changing patterns of behavioural decision-making in equity investments among family business investors, with a particular focus on the intergenerational shift from traditional media sources such as newspapers and television to digital and social media platforms. The study aims to understand how generational influence, digital literacy, and technological expectations affect behavioural intention and the quality of investment decision-making within family-owned businesses. Using a purposive sampling technique, data were collected from 227 respondents from family-owned enterprises through a structured questionnaire. The main variables considered in the study include performance expectancy, effort expectancy, social influence, sentiment, credibility, family generational influence, behavioural intention, and investment decision-making. The collected data were analysed using SPSS and AMOS. The analyses included reliability testing, correlation analysis, regression analysis, mediation analysis, and structural equation modelling (SEM). The findings reveal that second-and third-generation family investors show a stronger preference for social media platforms due to their higher level of digital fluency and familiarity with technology. Furthermore, behavioural intention was found to mediate the relationship between digital transformation factors and the quality of investment decision-making. The study highlights the growing influence of digital platforms and social media on investment behaviour among different generations in family businesses. The study provides practical implications for financial institutions, fintech firms, and policymakers in developing intergenerational digital literacy initiatives and creating user-friendly investment platform ecosystems within family businesses. The study also contributes to the existing literature by integrating technology adoption models with intergenerational behavioural finance perspectives and by positioning family generational influence as an important independent construct in understanding investment decision-making in family firms. © 2026, Qubahan. All rights reserved.","Intergenerational Shifts in Equity Investment Behavior: From Traditional Media to Social Media Among Family Business Investors","behavioural intention; family-owned business; generational divide; generational media shift; intergenerational dynamics; investment behaviour; social media; technology driven investment",2026,"10.48161/qaj.v6n2a2403"
"KARAYALCIN S, 2025, ADM SCI","Family businesses are a significant part of the global economy, yet defining them and understanding their features remains a topic of debate. Despite the suggestion that family ownership may lead to conservative innovation strategies, recent research indicates that family businesses can embrace strategic risk in innovation. Governance of innovation in family firms is a growing area of interest, with corporate governance influencing R&D and innovation decisions. The role of CEOs in family businesses is critical for innovation strategies, with family CEOs often prioritizing long-term interests. However, research on innovation in Turkish family businesses is lacking, offering an open area for exploration. This article investigates the influence of CEO type (family vs. non-family) on product innovation, innovation management processes, strategic decision-making, risk-taking behaviors, technology adoption, and emotional attachment within Turkish family businesses. A survey methodology was employed, reaching out to Turkish family businesses with a CEO involved in product innovation. The study found that, while family CEOs exhibit a stronger emotional attachment compared to non-family CEOs, there was no significant difference in the perceived influence of CEOs on product innovation. Non-family CEOs were not significantly more likely to implement formal innovation management processes or prioritize long-term strategic goals over short-term profits. Similarly, there was no significant evidence supporting the notion that non-family CEOs are more likely to engage in risk-taking behaviors compared to family CEOs. The study suggests a need for further research using a larger sample and diverse methodologies to deepen understanding of family business dynamics, particularly in the context of innovation. © 2025 by the author.","The Effect of Family vs. Non-Family CEOs on Product Innovation in Turkish Family Businesses","family business innovation; family businesses; Turkish CEOs",2025,"10.3390/admsci15060200"
"RIETMANN C, 2023, EUR PLANN STUD","We examine the role of Hidden Champions in rural areas in advancing regional digitalization through corporate local and regional responsibility and place leadership. Endowed with abundant internal resources and high innovative capacity, these global niche market leaders face regional resource constraints, concerning digital infrastructure and workforce with digital capabilities. 57 semi-structured interviews with firm representatives and regional actors in rural Germany are analyzed. We show that these enterprises strategically use measures of corporate local and regional responsibility and exert place leadership to develop digitalization-related assets in their rural regions. These initiatives are operated through modes of both inclusive and exclusive agency and benefit. We find that the motives for these actions are grounded in a perceived lack of swiftness and capacity of public actors, but also entail emotional attachment to the region, particularly for family businesses. Our findings have implications for regional policymakers, such as targeting greater alignment of regional and corporate development goals. © 2022 The Author(s). Published by Informa UK Limited, trading as Taylor & Francis Group.","Corporate responsibility and place leadership in rural digitalization: the case of Hidden Champions","Corporate local and regional responsibility; digitalization; Hidden Champions; place leadership; rural areas",2023,"10.1080/09654313.2022.2059345"
"LANNON F, 2024, J FAM BUS MANAG","Purpose: This perspective article responds to the emergence of artificial intelligence (AI) as a significant opportunity for growth among family businesses, highlighting the need for future research to attain a clear picture of the next generation of family business successors. Design/methodology/approach: This is a literature review of current technology adoption within family businesses. The authors offer some research insight to spur critical thinking and discourse around the impact of AI on family business successors. Findings: Family businesses are initially skeptical of AI technology. However, its use and adoption are crucial for the survival of the family business. To leverage this technology, the authors need to investigate the role of the family business successors as “Gen AI.” Originality/value: It is challenging but necessary to develop policies and educational support for successors to ensure the survival of family businesses worldwide. The authors propose four key areas of future research. © 2023, Finn Lannon, Roisin Lyons and Christina O'Connor.","Generation AI and family business: a perspective article","Artificial intelligence; Education; Successors",2024,"10.1108/JFBM-07-2023-0116"
"KOPALLE PK, 2025, J BUS RES","This study analyzes trends in research published in the Journal of Business Research (JBR) by examining 10,211 abstracts from 1973 to 2024. The analysis uses categorization (of articles published in 1977–1988 versus 2013–2024) and topic modeling (of articles published from 1973 to 2024) to identify key patterns. Key findings include: (1) A shift from conceptual papers to more empirical research with a substantive focus, (2) An increase in studies utilizing interviews, surveys, and secondary data, while papers with no data usage have decreased, and (3) A rise in advanced analysis techniques, including regression, structural models, machine learning, and textual analysis. The topic modeling analysis reveals an underlying topical structure of 19 JBR research themes. Emerging themes pertain to digital transformation and technology, value co-creation, customer and brand equity, green (product) development, transformational management, service management, and innovation management and performance. Stable JBR themes include family businesses, leadership and executive boards, communication channels, strategic decision making, business ethics and responsibility, knowledge management, advertising, consumer behavior, (international) entrepreneurship, and buyers and sellers. Declining research themes concern performance and uncertainty, and forecasting and foresight. Thus, the research areas have grown more diverse, with clear subfields receiving increased attention. At the same time, more studies have delved into narrower, specialized topics, allowing for deeper investigation. © 2025 The Authors","Journal of Business Research Publications 1973–2024: Topics, methodological approaches, data, and analyses conducted","Analyses; Approaches; Categorization; Data; JBR 50; Topic modeling",2025,"10.1016/j.jbusres.2025.115360"
