"doc_id","AB","TI","DE","PY","DI"
"BÜRGEL TR, 2023, TECHNOL FORECAST SOC CHANGE","While stressing the relevance of context, the organizational resilience literature has so far not extensively examined resilience in times of healthcare crises such as the ongoing COVID-19 pandemic. The Parasite Stress Theory of Values suggests that such pandemic crises have detrimental impacts on entrepreneurial activity due to social distancing and its effects on interaction, collaboration, and innovation. However, alternatives to personal contact now available thanks to digitalization, have not yet been examined. We expect entrepreneurial firms with more digitalized business models to show higher resilience to pandemic crises, especially those highly affected by globalization and more for non-family businesses than for family businesses. Based on a survey of German Mittelstand firms in the midst of the crisis induced by COVID-19, our findings broadly support our expectations and thus help qualify the Parasite Stress Theory of Values and contribute to a better understanding of organizational resilience in times of pandemic crises. © 2022 The Authors","Digitalization and entrepreneurial firms' resilience to pandemic crises: Evidence from COVID-19 and the German Mittelstand","COVID-19; Crisis; Digitalization; Family business; Globalization; Organizational resilience",2023,"10.1016/j.techfore.2022.122135"
"SFERRA AS, 2017, TECHNE","Architecture going back to meeting real needs entails social commitment, responding to the housing emergency caused by phenomena such as increasing urbanization and migration, environmental issues; furthermore through use of modest resources which induce to reflexions on the context within which a project may translate itself into reality. A context which has seen the building sector come out of the economic crisis, starting with industry 4.0, using new tools and techniques: digitization processes, prefabrication, as well as a new Procurement Code. A brief summary of the technical results and innovations of process and product achieved through a research between the PDTA Department of the Sapienza of Rome and a family business type enterprise operating also in the earthquake struck areas. © 2017 Firenze University Press","Emergency: innovative prefabricated construction components for an eco-solidarity architecture; [Emergenza: quale innovazione nei componenti prefabbricati per una edilizia ecosolidale]","Emergency; Environmental sustainability; Family business; Industry 4.0; Prefabricated components in reinforced EPS.",2017,"10.13128/Techne-20788"
"VARSHNEY N, 2025, ELECTRON J INF SYST DEV CTRIES","Sustainable family business performance has a complex relationship with knowledge transfer and knowledge sharing, as well as the mediating role of digital transformation and innovation capability of family businesses. This study examines these dynamics within family businesses in India. Data was collected from 259 family businesses using a survey method, and the analysis was performed using Partial Least Squares Structural Equation Modeling (PLS-SEM). The findings show positive and significant relationships among most variables, except for knowledge transfer and digital transformation, which showed a positive but insignificant effect. This weak correlation can be attributed to several factors, such as cultural and value differences and a lack of integrity and trust across generations. This study provides valuable insights into the benefits of digital transformation for policymakers, practitioners, and family business owners, emphasizing its importance in the context of an emerging advanced economy. © 2025 John Wiley & Sons Ltd.","Impact of Knowledge Transfer and Sharing on Sustainable Family Business Performance: The Moderating Role of Digital Transformation","digital transformation; family business; knowledge sharing; knowledge transfer; sustainable family business performance",2025,"10.1002/isd2.70016"
"APPLETON SW, 2024, INT J ENTREP BEHAV RES","Purpose: Digitalisation is perceived as a new process that may add value to firms. Current theoretical understanding assumes it should be part of a firm's strategy to respond to multiple pressures in the business environment. This paper explores the occurrence of digitalisation in a rare context, that of the English agricultural industry in the United Kingdom, a place disproportionality filled with family firms. The general understanding of digitalisation in family firm settings remains embryonic. The authors' explorations make theoretical contributions to research at the intersection of rural entrepreneurship, family business and innovation. Design/methodology/approach: Utilising a purposive, qualitative approach, primary data was collected from multiple interviews with 28 UK family farms, and secondary data from another 164. Interview transcripts were coded using NVivo, along with secondary data from reports, observations and websites. Findings: The authors present empirical evidence illustrating how digitalisation manifests incrementally and radically in different types of family farms. The authors present a model that shows the areas of farming that have, and continue to be, digitalised. This increases analytical precision when identifying digitalisation activities that differ depending on the strategy to either scale or diversify. The authors propose that incremental digitalising occurs to a great extent during a scaling strategy, and that radical digitalising occurs to a smaller extent during diversification strategies in family farms. Research limitations/implications: This research uses a sample of family-run farms from the UK agricultural sector to explore nuanced elements of digitalisation. It should therefore be explored in other types of family firms located in different sectors and geographies. Practical implications: This research is important because family farms are under increasing pressure and have limited financial resources to deal with the digitalisation agenda. Therefore, empirical evidence helps other farms in similar situations. The authors found digitalisation investments, that tend to be capital intensive, only matter for scalers and less so for diversifiers. Family farms can use the model presented as a tool to evaluate their farm. The tool helps them define what to do, and ideate the potential activities that might be digitalised, to feed into their wider strategy. Social implications: Family firms, in particular farms, are critical to many economies. The general consenses currently assumes all family firms should digitalise, yet the authors' evidence suggests that this is not the case. It is important to create policies that are sensitive to the needs of different types of businesses, in this case between family firm scalers and diversifiers, instead of simply incentivising digitalisation using a blanket approach usually by offering financial aid. Understanding how digitisation can support (or not) family firm resilience and growth in an effective and efficient manner can have significant benefit to individual firms, and across industries. Originality/value: The proposed model extends theoretical understanding linking strategy, digitalisation activity and innovation in family farms. It shows that digitalisation is a key building block of scaling strategies, maximising digitalisation to increase efficiency. Yet, diversifying family farms minimise digitalisation, whereby they only digitalise a small amount of the farming activity. This empirical evidence contrasts with the wider narrative that farmers are slower at using new technology. This research found that some are slower because it does not align with their strategy. However, sometimes digitalisation aligns with their strategy during external changes, in which case the diversifiers are quick to act. © 2023, Samuel Wayne Appleton and Diane Holt.","Aligning strategy and digitalisation activity as an incremental or radical innovation in family farms","Family business; Innovation; Qualitative techniques; Rural; Technology",2024,"10.1108/IJEBR-10-2022-0938"
"DASKALOPOULOS ET, 2024, J HIGH TECHNOL MANAGE RES","In pursuing competitive advantage, businesses are diffusing new digital technologies across their value chains and, by doing so, catalyzing significant organizational changes in operational processes and strategic approaches. This widespread evolution of businesses has prompted significant questions regarding the drivers of digital change, the necessary resources, and the capabilities that need to be developed or reconfigured. Our paper focuses on the role of intangible resources, such as a firm's social capital, and its specific implications for the broader research on this phenomenon. Consistent with the resource-based view, we examine the role of different types of social capital as critical resources in the digital transformation process while also considering the mediating role of the balancing act of the capabilities around business alignment and adaptation encompassed in the concept of ambidexterity. Furthermore, we introduce a contextual dimension to our study by examining family involvement in a firm as a significant factor influencing how businesses shape their digital goals and allocate resources toward digital transformation. Our paper addresses this under-explored research field by drawing on a large, cross-sectional dataset from an online panel study with 582 management-level participants from UK firms. After testing our hypotheses, our study's results indicate that bridging and bonding social capital resources significantly promote digital transformation by indirectly developing an ambidextrous orientation. Moreover, familial orientation strengthens both relationships. This research is currently one of the few studies providing empirical evidence on the relationship between digital transformation, its antecedents, and, specifically, the role of intangible resources. © 2024 Elsevier Inc.","Leveraging social capital for digital transformation: The role of ambidexterity and familial orientation","Ambidexterity; Digital transformation; Family business; Social capital",2024,"10.1016/j.hitech.2024.100512"
"MITROPOULOS P, 2024, J FAM BUS MANAG","Purpose: The purpose of this paper is to measure the high-quality entrepreneurial efficiency of family-owned small- and medium-sized enterprises (SMEs) while exploring the potential determinants of their performance. This study places particular emphasis on the firms' technological competencies and internationalization efforts. The authors aim to shed light on the internal and external characteristics that impact the efficiency of family SMEs. Design/methodology/approach: This study adopts a two-stage approach. In the first stage, a data envelopment analysis model is utilized to measure the high-quality entrepreneurial efficiency of family SMEs. To achieve this, this study considered as outputs three key quality aspects of entrepreneurship, namely innovativeness, export orientation and turnover rate, while the inputs were the number of employees and the business environment. Then, in the second stage, the efficiency scores are regressed against a set of environmental factors that may affect the efficiency. The proposed efficiency measurement models are utilized with a particularly rich dataset of 1,910 family SMEs from 35 developed countries. Findings: The results demonstrated that the efficiency of family SMEs primarily engaged in the production of goods was significantly higher than those providing services. Importantly, the presence of barriers related to innovation and digitalization had a pronounced negative impact on efficiency. Additionally, scale-up firms exhibited higher levels of efficiency. When examining family SMEs within their national context, it was observed that non-EU countries and countries with a higher gross domestic product displayed significantly higher efficiencies. Originality/value: The findings of this research provide guidance for the development of entrepreneurship-oriented policies that consider both the internal characteristics of family SMEs and the diverse socioeconomic contexts in which they operate. © 2023, Emerald Publishing Limited.","Factors affecting high-quality entrepreneurial performance in small- and medium-sized family firms","Data envelopment analysis; Family firms; High-quality entrepreneurship; Performance evaluation",2024,"10.1108/JFBM-09-2023-0171"
"KRYEZIU L, 2024, J ENTERPRISING COMMUNITIES","Purpose: This study aims to examine the impact of regulatory, normative and cultural cognitive institutions and firm and individual factors on entrepreneurial behavior. Design/methodology/approach: Using the quantitative research method, the authors collected data from 316 micro, small and medium enterprises (MSMEs) in Kosovo, a transition economy, through a cross-sectional research design. The authors performed exploratory factor analyses, correlation and regression analyses on the data using SPSS 26 and STATA software. Findings: The research findings indicate that, within transition economies, normative and cultural-cognitive institutions have a positive impact on entrepreneurial behaviors. The authors could not determine the effect of regulatory institutions on entrepreneurial behavior. The authors also discovered that young firms are more inclined toward entrepreneurial behavior than older firms, and micro firms display a stronger entrepreneurial behavior than small firms. Furthermore, family businesses showed a greater tendency for entrepreneurial behavior than nonfamily firms. Interestingly, when the rational decision-making interacts with regulatory institutions, the effect on entrepreneurial behavior is negative. Research limitations/implications: This study employed a cross-sectional approach to investigate the influence of macro, meso, and micro-level factors on entrepreneurial behavior within a transitioning community across three industries. Future studies could replicate these findings within comparable institutional contexts, employing longitudinal studies that include additional variables beyond those considered in our present study. Practical implications: Considering the importance of MSMEs for a country’s economic and sustainable development, the authors provide some policy implications. The authors recommend managers carefully evaluate the information gathered while they decide and also increase their capabilities concerning digitalization, which is crucial for their firm’s survival, growth and sustainable competitive advantage. Originality/value: This paper contributes to the literature and shows and analyses entrepreneurial behavior at institutional (macro), firm-level factors (meso) and managers' rational decision-making (micro), providing evidence from a transition community. © 2023, Emerald Publishing Limited.","The effects of institutions, firm-level factors and rational decision-making on entrepreneurial behaviors of MSMEs: lessons and opportunities for transition communities","Entrepreneurial behavior; Firm-level factors; Institutions; MSMEs; Rational decision-making",2024,"10.1108/JEC-05-2023-0075"
"DE GROOTE J, 2023, BUS HORIZ","Family-owned Mittelstand firms have often been characterized as Janus-faced, meaning they can have two contrasting sides when it comes to innovation. On one side, they are technology leaders—especially in niche markets. On the other side, they can be slow adopters, deeply rooted in tradition. Digitalization is one of the biggest innovation challenges to firms of all sizes and ownership types. Research and observations in business practice show that while some family-owned Mittelstand firms master digitalization despite limited resources and traditional industries, others lag dangerously behind. So, how can family-owned Mittelstand firms prepare for a digital future, and which familial idiosyncrasies might help them? Based on current observations and interview data, we propose a framework for how these firms can use their unique resources to tackle challenges related to digitalization. To be successful in a digital world, they must leverage their family historical capital, family collaborative capital, and family venture capital. We highlight why and how these capital types should be linked to fully leverage their potential. © 2022 Kelley School of Business, Indiana University","How can family-owned Mittelstand firms use their unique resources to master the digitalization age? The role of family historical, venture, and collaborative capital","Digital business; Family firms; Innovative business; Mittelstand firms; Venture capital",2023,"10.1016/j.bushor.2022.04.001"
"TUTAR H, 2022, MANAGE RES REV","Purpose: There has been a rapid generational change in the business world in Turkey recently, and X generation managers are rapidly leaving their place to Y generation managers. In countries with relatively young populations such as Turkey, management in family businesses passes into the hands of Generation Y. This study aims to examine the moderator role of the difference between old and new generation Y in the effect of self-efficacy perceptions on decision-making strategies. Design/methodology/approach: This research, which was designed according to the quantitative research method, was designed according to the cross-sectional survey model, one of the general survey models. The research data were collected from a sample of 441 family business managers determined according to the simple random sampling technique. The data were analyzed and interpreted with various statistical techniques. Data analysis was done with AMOS. 20 and International Business Machines statistical package for the social sciences 22 data analysis programs. Findings: According to the analysis findings, there is a significant relationship between the participants’ self-efficacy perceptions and decision-making strategies. Research findings old and new generation Y managers have different decision strategies. The research results showed that the dominant self-efficacy perceptions of the Y generation affect their decision-making strategies. Research limitations/implications: This research only examines whether the old and new generation Y perceptions have a moderator function in the relationship between the participants’ self-efficacy perceptions and decision-making strategies. The research is quantitative research limited to family businesses. The results can be compared by repeating the research with other variables and in different samples, for example, by researching in public institutions. In addition, the way of reflecting the differences in perception to the management can be subjected to deeper analysis with mixed studies. Practical implications: One of the important reasons for the difference in people’s approaches to events is their personality structure. Generational differences, which have been discussed primarily in recent years, make themselves felt in working life. The new working models arising from the different perspectives of the Y generation differ from the traditional business models. Today, in traditional business models, the manager profile is usually the X generation. However, the process is moving toward gaining essential positions in the management levels of the new Y generation. They put traditional managers in a difficult situation with their impatient behavior and desire to climb the career ladder quickly. Social implications: In the studies conducted on the Y generation, it is understood that they do not favor the classical management approach based on the command-command relationship. The sense of loyalty of the Y generation is low compared to other generations and their organizational commitment levels are weak. There are determinations that they attach importance to flexible working style and want to do business using digital technologies. They are highly motivated in setting vision and participating in strategic decisions in organizations. These features differ significantly from the X-generation managers who adopt the traditional management approach. Originality/value: Both emotional and cognitive characteristics influence decision-making behavior. The generation gap which shows common personality structures in a certain period is an important predictor of decision-making strategy. Research results and related studies significantly affect the decision strategies of the generation gap. No research has been found comparing the old and new Y generations. In this respect, it is thought that the research will contribute to theory, practice and method. © 2021, Emerald Publishing Limited.","Moderator role of old and new Y generation differences in the effect of perceptions of self-efficiency on decision-making strategies","Decision; Decision strategies; Decision-making; Decision-making strategies; Generation; Generation Y; Moderating role; New Y generation; Organizational behavior; Self-efficacy perception",2022,"10.1108/MRR-01-2021-0026"
"APERGIS E, 2019, J HIGH TECHNOL MANAGE RES","The present analysis performs a Multinomial Probit Model in order to observe which mobile technology qualifies across individuals. The findings indicate that individuals in family businesses prefer to combine both tablets and smartphones in their purchases, rather than separately. Younger individuals report an adoption preference towards smartphones, while older individuals are inclined towards tablets. The theoretical contributions encompass both the technology acceptance model (TAM) and the social cognitive theory (SCT). Individuals working in a family business exhibit a curious behaviour and they are becoming early adopters. TAM helps explain this behaviour as they tend to try new novelties exploring the potential usefulness they might derive; these technological advancements allow them to connect with customers and partners. By contrast, SCT helps gain a better understanding on young and old individuals' behaviour. The younger generations seem to be easily influenced by their peers with a tendency to technologies which are fun and allow them to build connections. Older individuals are equally influenced by their peers, with the difference that their social circle being more mature (e.g., business owners, professionals). This combined with the complexity of the technology orients them into adopting tablets more easily than smartphones. © 2019 Elsevier Inc.","Who is tech savvy? Exploring the adoption of smartphones and tablets: An empirical investigation","Combined technology; Family business; Smartphone adoption; Tablet adoption",2019,"10.1016/j.hitech.2019.100351"
"FERRARO O, 2021, J RISK FINANC MANAG","Throughout the review of the most relevant literature on family businesses and business valuation, this work pursues a twofold purpose: to explore the possible evolutionary scenarios of family businesses in the era of digitalisation, highlighting their role and purpose; and to determine the valuation approaches that may be applied to them, also in light of the different role that intangible assets deriving from their digitalisation may assume. Therefore, after a description of the most relevant changes related to the digital transformation of the FB, the focus will be set on their valuation, paying special attention to the choice of the most appropriate methodology for “grasping” the aforementioned changes. Family businesses, in fact, due to their distinctive traits and the various estimation opportunities, require a dynamic business valuation process that has to be projected into the future and suitable for estimating those intangible assets that strongly characterise these types of companies, inasmuch as they are related to the implicit components that are strongly connected to the ownership and are a result of knowledge, strategic adaptability, and product innovation, and their possible impact on the risks and their expected flows. Thus, throughout a systematic literature review, the study provides, on the one hand, a clearer representation of the state of the art of the FB valuation in the digital age; on the other hand, it highlights the characteristics and peculiarities of “novel” FBs whose valuation needs to be conducted with due care. © 2021 by the authors.","Family Business in the Digital Age: The State of the Art and the Impact of Change in the Estimate of Economic Value","business valuation; digital era; digital transformation; family business",2021,"10.3390/jrfm14070301"
