"doc_id","AB","TI","DE","PY","DI"
"BRENK S, 2019, J BUS ECON","Established organizations need to adapt their current business models (BMs) to match dynamic changes in their environment. Alternatives to the established BM usually incorporate a different logic of how value is created, offered, and captured. When selecting and implementing the best BM alternative, organizations have to make decisions on several highly uncertain questions: What will the future look like, on what basis should we take action, how do we act under risks and limited resources, and how should we behave in light of unexpected events and towards outsiders. Firms can apply the logic of causation or that of effectuation when making these decisions. In this context, we apply a longitudinal single case study of a manufacturing company encountering a digital transformation journey. In this case study, we investigate the shift from a product-based to a smart service model and the underlying process of decision-making in the context of business model innovation (BMI). From our case study, we identify latent conflicts resulting from two different BM logics: the logic of value offering, creation, and capture of the dominant (established) BM versus that of the new one. We show that logic conflicts become especially visible when actors cannot reduce uncertainty about the new BM effectively. These conflicts finally inhibit the change of the dominant BM to the new one. Sensemaking in the company about the latent logic conflicts within the BMI process reveals the need to change its decision-making logic from managerial causation to intrapreneurial effectuation. The findings from our study contribute to entrepreneurship and institutional theory while highlighting the concept of institutional intrapreneurship for BMI. Our results suggest separating the alternative BM from the existing one. This separation can reduce cognitive uncertainty associated with BMI processes through logic pluralism, i.e., building a new decision-making logic in parallel to the old one. We contribute to the BMI literature by adding logic conflicts of BMI and the decision-making logic of an organization to the list of important contingency factors that influence the execution and outcome of a BMI process. © 2019, Springer-Verlag GmbH Germany, part of Springer Nature.","Learning from failures in business model innovation: solving decision-making logic conflicts through intrapreneurial effectuation","Business model innovation; Causation; Digital transformation/Digitization; Effectuation; Family business; Institutional entrepreneurship; Institutional logic; Institutional theory; Logic pluralism; Longitudinal single case study; Mixed-method; Pivoting; Sensemaking; Value migration",2019,"10.1007/s11573-019-00954-1"
"ANGELOVA M, 2023, ECON STUD","Micro, small and medium-sized enterprises, be they traditional enterprises, family businesses, traders, social economy enterprises, crafts or liberal professions (referred to hereafter as MSMEs), are an essential part of the solution towards a competitive, climate-neutral, circular and inclusive European economy, provided that the right conditions are created and prevail. The positive impact is generated by MSMEs through improving their own environmental performance and through providing expertise and solutions to other enterprises, citizens and the public sector. While acknowledging and highlighting the diversity and different needs of the European MSMEs, the current paper focuses on identifying factors for boosting their green transition and mapping out the effects of the recent multiple crises on this process. © 2023, Bulgarska Akademiya na Naukite. All rights reserved.","FACTORS FOR BOOSTING THE GREEN TRANSITION OF THE EUROPEAN MICRO, SMALL AND MEDIUM-SIZED ENTERPRISES","digitalization; micro enterprises; MSMEs; small and medium-sized enterprises; social responsibility; support policies; sustainability",2023,""
"WU M, 2024, FINAN RES LETT","Investment efficiency is a bottleneck problem in the development of Chinese family enterprises. The study takes Chinese family-listed companies as samples to explore the impact of de-familiarization governance on investment efficiency of these firms. It is found that de-familiarization governance can effectively improve investment efficiency of enterprises, and this effect is particularly pronounced in the context of environmental uncertainty. Mechanism tests reveal that de-familiarization governance improves the investment efficiency of family businesses by enhancing managerial ability and promoting digitalization. Further analysis shows that in the context of relatively low industry competitiveness, the positive effect of de-familiarization governance on investment efficiency is more significant. The conclusions enhance our understanding of dynamic development and behavioral impact of family business governance within the current economic context, and provide new insights for family businesses seeking to enhance investment efficiency and undergo transformation and upgrading. © 2024 Elsevier Inc.","De-familiarization governance and family firm investment efficiency","De-familiarization governance; Digitalization; Environmental uncertainty; Investment efficiency; Managerial ability",2024,"10.1016/j.frl.2024.105219"
"ZHANG Y, 2026, TECHNOL SOC","The digital era imposes significant transformation pressures on family firms and has drawn increasing scholarly attention to their digital transformation drivers. However, the influence of top management team (TMT) interactions on strategic decision-making remains underexplored. Based on subgroup theory, this study examines the impacts of TMT faultlines on digital transformation and their mechanisms. Analyzing panel data from Chinese listed family firms (2012–2022), we find that TMT identity-based faultlines hinder digital transformation by weakening dynamic capabilities. However, this indirect effect diminishes in highly dynamic environments. Conversely, knowledge-based faultlines promote digital transformation by enhancing dynamic capabilities, with environmental dynamism strengthening the indirect effect. Overall, this study deepens the understanding of the micro drivers of family firms’ digital transformation and provides practical guidance for them to achieve digital transformation. © 2025 Elsevier Ltd.","Divided we transform? Top executive team faultlines and digital transformation in family firms","Digital transformation; Dynamic capabilities; Environmental dynamism; Family firms; TMT faultlines",2026,"10.1016/j.techsoc.2025.103125"
"MASMOUD A, 2026, PROBL PERSPECT MANAGE","The performance of family-owned small and medium-sized enterprises is a primary concern for their leaders. Through digital transformation, these firms are able to create added value and promote their growth. This study examines the effect of digital transformation on the performance of family SMEs, considering the moderating role of family involvement in management. As a result, a quantitative study was adopted using an online survey. Data were collected from a purposive sample of 182 Moroccan family SMEs, with responses obtained from their owner-managers between September and October 2025. In addition, the data were analyzed using structural equation modeling (SEM) with SMART PLS 4 software. The results confirm that the digital transformation of family SMEs has a positive effect on their commercial (β = 0.532, p < 0.05) and financial (β = 0.249, p < 0.05) performance but has no significant effect on operational performance (β = 0.124, p > 0.05). Furthermore, family involvement in management negatively moderates the relationship between digital transformation and commercial performance (β = –0.166, p < 0.05) and positively moderates the relationship between digital transformation and operational performance (β = 0.309, p < 0.05). Moreover, family involvement does not affect the relationship between digital transformation and financial performance (β = 0.040, p > 0.05). The results explain the importance of implementing new digital technologies in family SMEs to improve performance and highlight the nuanced, dual role of family involvement as both an inhibitor and a facilitator. © Abderrahim Masmoud, Youssef Tichoua, 2026.","The effect of digital transformation on family SME performance: The moderating role of family involvement","digital transformation; family businesses; family involvement; Morocco; performance; SMEs",2026,"10.21511/ppm.24(1).2026.39"
"LIU Z, 2023, J BUS RES","Digital transformation (DT) has been identified as one of the major trends that is changing society and business. Firms respond strategically to the DT trend in different ways. The results of this study, based on Chinese listed companies, demonstrate that, as family firms have stronger needs for legitimacy and are sensitive about investing in uncertain projects, they are more likely than their non-family counterparts to disclose more symbolic cues about DT while investing less substantively in DT, that is, they emphasize DT in their annual reports to a greater extent while making fewer digital investments. We also investigated firm- and provincial-level contingencies. Specifically, we show that family firms located in provinces with better digital infrastructure are more likely to disclose symbolic cues about DT and invest substantively in DT. Family firms that have completed the intergenerational succession process are shown to be more likely to disclose symbolic cues about DT. © 2022 Elsevier Inc.","How do family firms respond strategically to the digital transformation trend: Disclosing symbolic cues or making substantive changes?","Digital transformation; Digitalization; Family firm; Intergenerational succession; Local digital infrastructure",2023,"10.1016/j.jbusres.2022.113395"
"GUPTA M, 2025, ELECTRON J INF SYST DEV CTRIES","The current study aims to identify the key determinants of the adoption of digital innovations and applications in family businesses using a case analysis-based qualitative research method. It explores the process used by these business houses to initiate and implement smart technologies to improve their business operations, suffice the customers dynamic expectations, extend their market share, and inhibit innovative practices. This paper shares insights about the major areas such as the digitalization of trade activities, e-commerce practices, green marketing, and using data analytics for strategizing and decision-making activities. While investigating the implementation of digital technologies like online payment systems, the use of social media platforms for advertising, and smart 3D design technology, and so forth the paper also unravels the determinants of adopting digitally innovated technologies in family businesses such as resistance from employees, financial constraints, and the inability to blend modern technologies within traditional organizational setting. The study highlights the changing dimensions in Indian business firms while sharing the practical and theoretical implications for business leaders, next-generation family business successors, and futuristic researchers. © 2025 John Wiley & Sons Ltd.","Exploring the Determinants of Digital Innovation Adoption in Indian Family-Owned Enterprises: A Case-Based Study","case study; digital innovation; e-commerce; entrepreneurship; family-based entrepreneurial ventures",2025,"10.1002/isd2.70012"
"AFZA KALEEM KH, 2026, OIDA INT J SUSTAINABLE DEV","Family firms largely rely on the idea of the adoption of artificial intelligence trust (AI) aiming at developing trust in the technology and their organizational culture, family firms have a higher chance of successfully managing the challenges of AI implementation and increase their performance optimized performance and still maintained their most important values. The family firm culture tends to be dominated by the culture within family firms puts emphasis on people and traditional ways rather than on technological innovation. This resistance to adopting AI solutions can be produced by culture inclination since family members will be afraid becoming out of control or values. The review is a synthesis of the available studies on trust in AI, explaining the ways family firms can use the trust premium inherent to them to support technology adoption. Consequently, family firms' extractive economies are unable to experience sustained value knowledge creation through competitiveness. Enabling environments work within which knowledge creation ensues, leading to the achievement of the development agency goals and the enhancement of the bilateral/unilateral strategic alliance relationship. © Authour(s).","The Role of Trust in AI Adoption among Family Firms","Artificial Intelligence AI; family enterprise; family firms; management; Trust; values",2026,"10.64211/oidaijsd190207"
"NIMANANDH K, 2025, ASIA PAC BUS REV","Association of Southeast Asian Nations (ASEAN)-focused research remains under-represented in the Asia Pacific business literature to date. Despite the region’s growing role in the global business landscape, the bulk of scholarly investigation is still rooted in an East Asian-centric perspective. Comprising a mix of empirical and secondary-based investigation, the papers in this collection embody a modest attempt to address this caveat. However, further work is needed to consolidate, deepen and extend how we understand the diversity and complexity that has long characterized the Southeast Asian commercial arena. Opportunities for future theory and practice advancement to stem from this Special Issue include the areas of technology adoption and implications, city destination branding, internationalization and micro-level strategy formation and implementation. More general research streams which would benefit from ASEAN ratification and extension include institutional context, socio-economic inequality, linguistic diversity and the internationalization behaviour of family firms. © 2025 Informa UK Limited, trading as Taylor & Francis Group.","Business research in Association of Southeast Asian Nations (ASEAN): recapitulation and prospects","ASEAN business research; city branding; innovative technology adoption; institutional context; SME internationalization; strategy implementation",2025,"10.1080/13602381.2025.2512814"
"SOUDER D, 2017, STRATEGIC MANAGE J","Research summary: In family businesses, investment decisions often involve both socioemotional wealth and economic considerations. Focusing on new technology adoption, we argue that multiple dimensions of socioemotional wealth contribute to complex effects within different types of family firms—depending on the level of family control—as well as in contrast to non-family firms. Results based on cable TV operators from 1983 to 1987 confirm that family ownership correlates negatively with technology adoption, especially when family owners hold a minority rather than majority position. We also show contingencies based on performance improvements and competitive threats. Our arguments contribute new insights about the tensions between economic and socioemotional factors within minority family ownership that are absent from non-family firms and more pronounced than in majority family firms. Managerial summary: We find evidence of greater reluctance toward new technology adoption among firms with minority family influence than majority family influence. This suggests that goals related to socioemotional wealth only partly explain the cautious decision-making observed in family firms, with further caution arising from conflicting priorities between family and non-family owners. Recent performance improvements help offset the reluctance to adopt new technology, albeit to a lesser degree among firms with minority family ownership. High levels of competitive threats also offset the reduction in new technology adoption, and contrary to expectations, to a greater extent among minority family firms. Copyright © 2016 John Wiley & Sons, Ltd. Copyright © 2016 John Wiley & Sons, Ltd.","How family influence, socioemotional wealth, and competitive conditions shape new technology adoption","family firms; investment policy; socioemotional wealth; technology adoption; threat of competition",2017,"10.1002/smj.2614"
"BEGNINI S, 2024, J FAM BUS MANAG","Purpose: Analyzing the effect of digitalization strategies and barriers to digital transformation (DT) on the use of technologies, in the Brazilian context, is necessary to broaden the understanding of topics in emerging economies. Thus, empirical research to evaluate and analyze aspects related to DT in small and medium-sized family businesses in an emerging economy is necessary, as it is a necessary strategic alternative in the current context. Design/methodology/approach: Using data from a survey conducted with 210 managers of Brazilian family businesses, the authors analyzed the positive cause and effect relationship between digitalization strategy and technology use. In addition, the authors seek to explore the moderating effect of barriers to digital development on the relationship between digitalization strategy and technology use. This analysis was conducted using the structural equation modeling technique, with the help of SmartPLS 4.0 software. Findings: The findings confirm the positive relationship between the implementation of digitalization strategies and technology usage in small family businesses, thereby contributing to the broader analysis of how small family businesses employ and define their digitalization strategies. Furthermore, the authors identified barriers that hinder the development and utilization of technology for digitalization purposes. Originality/value: This study fills gaps in empirical research by explaining the factors that drive barriers to DT in small family businesses. It contributes to advancing the understanding of digitalization strategies used by family SMEs and identifies the real strategic value opportunities that DT represents for businesses. © 2023, Emerald Publishing Limited.","The relationship between the use of technologies and digitalization strategies for digital transformation in family businesses","Development; Digital transformation; Digitalization strategies; Family businesses; Technology",2024,"10.1108/JFBM-06-2023-0087"
"KO WW, 2025, MANAGE ORGAN REV","Digital transformation presents a crucial strategic imperative for family businesses seeking to maintain competitiveness and long-term viability. The academic literature reveals divergent perspectives on how family businesses approach digital transformation initiatives. This study adopts a socioemotional wealth perspective to examine the relationship between family ownership and digital transformation. The research specifically investigates how family formal business networks and next-generation dispersion moderate this relationship. Analysis of panel data from Chinese listed family firms between 2016 and 2020 reveals that family ownership negatively influences digital transformation efforts. However, this negative effect diminishes when family firms participate in formal business networks or involve multiple next-generation members in leadership positions. These findings yield important theoretical contributions regarding the intricate relationships between family dynamics and technological advancement. The research also provides practical insights for family business leaders navigating digital transformation challenges. This study advances understanding of how different dimensions of socioemotional wealth shape family firms’ strategic responses to technological change. © The Author(s), 2025. Published by Cambridge University Press.","Family Ownership and Digital Transformation: The Role of Family Formal Business Networks and Next-Generation Dispersion","digital transformation; family firms; formal business networks; next-generation dispersion; socioemotional wealth",2025,"10.1017/mor.2025.10077"
"MOKHA AK, 2025, VISION","The present study has aimed to understand the customers’ behavioural intention to use electronic customer relationship management (E-CRM) in the banking industry, using the technology acceptance model (TAM). Purposive sampling technique is used to collect data from 300 banks that included customers from Delhi (India), and partial least square-structural equation modelling (PLS-SEM) was employed. The reliability and the validity of the overall model were evaluated using the measurement model, and the hypotheses were tested using the structural model. The results reveal that E-CRM had a positive impact on both perceived usefulness and perceived ease of use, which, in turn, had a positive impact on the attitude towards using E-CRM, which ultimately led to a positive behavioural intention of customers towards using E-CRM. This study reveals that there is a large potential for policymakers to raise awareness and acceptance of E-CRM services among the customers. © 2025 MDI.","Using the Technology Acceptance Model (TAM) in Understanding Customers’ Behavioural Intention to Use E-CRM: Evidence from the Banking Industry","Family Firm; Family Management; India; Research and Development",2025,"10.1177/09722629211060565"
"DASÍ À, 2025, J SMALL BUS ENTREP","Research shows that digital transformation (DT) of small and medium-sized family firms is a major challenge, where family dynamics introduce idiosyncrasies in how managers sense, seize, and orchestrate DT. In this study, we focus on those dynamic managerial capabilities that are closely related to individual cognitive traits - sensing and seizing–to understand how they operate at the individual level and how they interact at the team level in such a transformation process. We draw on an in-depth case study of the digital transformation of a family business, the largest independent fashion retailer in the Netherlands. Our microfoundational lens sheds light on the mechanisms through which familiness underpins dynamic managerial capabilities for DT. Specifically, we identify purposeful friction as an interpersonal capability that modifies individual managers’ sensing and contributes to the bridge between sensing and seizing. To complete the model, we identify collaborative value-based decision making and experimental implementation as team-level capabilities that underpin DT seizing. Our theoretical model contributes to the current literature by unraveling the microfoundations of how team-level interaction enhances individual managers’ sensing and seizing capabilities for digital transformation in the context of family firms. © 2023 Journal of the Canadian Council for Small Business and Entrepreneurship/Conseil Canadien de la PME et de l’entrepreneuriat.","Without friction, no shine: how dynamic managerial capabilities combine for family firms’ digital transformation","capacités managériales dynamiques; Digital transformation; dynamic managerial capabilities; entreprise familiale; esprit de famille; familiness; family firm; micro-fondements; microfoundations; transformation numérique",2025,"10.1080/08276331.2023.2281152"
"MEROÑO-CERDÁN AL, 2017, BEHAV INF TECHNOL","The use of information and communication technologies has allowed employees to perform work at an approved alternative worksite. Although family firm is the predominant form of business organisation, no study has analysed their peculiarities in adopting teleworking practices. Family firms are characterised by the alignment of interests of ownership and management, long-term orientation and the pursuit of non-economic objectives. Grounded in the socio-emotional wealth approach and the Technology Acceptance Model, this study examines the idiosyncrasies of family governance in the perception of teleworking benefits and barriers to the adoption of teleworking. Using a sample of 200 Spanish companies, differences are found in the perceived barriers to teleworking. Although family firms perceive higher barriers, they do not influence on teleworking adoption. In contrast, in non-family firms, the decision to adopt teleworking is influenced by both the perceived benefits of teleworking and the perceived barriers. This means that Spanish family firms adopt teleworking evaluating only the perceived benefits. Although family firms may fear problems arising from teleworking when they decide to adopt it, they are more confident in their ability to implement it. © 2016 Informa UK Limited, trading as Taylor & Francis Group.","Perceived benefits of and barriers to the adoption of teleworking: peculiarities of Spanish family firms","barriers; benefits; family firms; innovation; Teleworking",2017,"10.1080/0144929X.2016.1192684"
